{
  "$schema": "../../../schema/lesson.schema.json",
  "id": "vi-south.u14.l03",
  "unit": "vi-south.u14",
  "title": {
    "fr": "Ngon, dở",
    "en": "Tasty, not tasty"
  },
  "goal": {
    "fr": "Juger un plat, poliment.",
    "en": "Judge a dish, politely."
  },
  "estimatedMinutes": 6,
  "prerequisites": [
    "vi-south.u14.l02"
  ],
  "concepts": [
    "c_do_bad",
    "c_do_dirty",
    "s_do_qua",
    "s_cung_duoc",
    "c_hoi_slightly",
    "c_pho",
    "c_com_tam",
    "c_banh_mi"
  ],
  "steps": [
    {
      "type": "listen_pick_text",
      "concept": "s_do_qua",
      "distractors": [
        "Ngon quá!",
        "Dơ quá!"
      ],
      "explain": {
        "fr": "dở : pas bon. dơ : sale.",
        "en": "dở: not good. dơ: dirty."
      }
    },
    {
      "type": "culture_card",
      "ref": "cc_do_south"
    },
    {
      "type": "tone_minimal_pair",
      "pair": [
        "dở",
        "dơ"
      ],
      "audioConcepts": [
        "c_do_bad",
        "c_do_dirty"
      ],
      "explain": {
        "fr": "dở plonge : pas bon. dơ reste plat : sale.",
        "en": "dở dips: not good. dơ stays level: dirty."
      }
    },
    {
      "type": "spot_the_south",
      "variant": "lv_dirty",
      "explain": {
        "fr": "Sud : dơ ; Nord : bẩn.",
        "en": "South: dơ; North: bẩn."
      }
    },
    {
      "type": "listen_pick_text",
      "concept": "s_cung_duoc",
      "distractors": [
        "Cũng vậy.",
        "Không được."
      ],
      "explain": {
        "fr": "Cũng được : ça va, c'est correct.",
        "en": "Cũng được: it's okay."
      }
    },
    {
      "type": "build_sentence",
      "target": "Món này hơi dở.",
      "tokens": [
        "Món",
        "này",
        "hơi",
        "dở",
        "dơ"
      ],
      "translation": {
        "fr": "Ce plat n'est pas terrible.",
        "en": "This dish isn't great."
      },
      "explain": {
        "fr": "hơi + adjectif : un peu. Plus doux que dở quá.",
        "en": "hơi + adjective: a bit. Softer than dở quá."
      }
    },
    {
      "type": "listen_pick_image",
      "concept": "c_pho",
      "distractors": [
        "c_com_tam",
        "c_banh_mi"
      ],
      "explain": {
        "fr": "phở : la soupe de nouilles.",
        "en": "phở: noodle soup."
      }
    },
    {
      "type": "fill_gap",
      "text": "Món này ngon ___!",
      "answer": "quá",
      "options": [
        "quá",
        "qua",
        "quà"
      ],
      "translation": {
        "fr": "Ce plat est trop bon !",
        "en": "This dish is so good!"
      },
      "explain": {
        "fr": "quá après l'adjectif = trop, tellement. qua = passer, quà = cadeau.",
        "en": "quá after an adjective = so, too. qua = to pass, quà = gift."
      }
    },
    {
      "type": "game",
      "game": "bua_com",
      "conceptPool": "lesson"
    },
    {
      "type": "speak_repeat",
      "concept": "s_cung_duoc",
      "explain": {
        "fr": "cũng et được : deux tons qui cassent.",
        "en": "cũng and được: two broken tones."
      }
    },
    {
      "type": "listen_pick_text",
      "concept": "c_do_bad",
      "distractors": [
        "dơ",
        "ạ",
        "rẻ"
      ]
    },
    {
      "type": "listen_pick_text",
      "concept": "c_do_dirty",
      "distractors": [
        "dở",
        "ga",
        "chua"
      ]
    },
    {
      "type": "listen_pick_text",
      "concept": "c_hoi_slightly",
      "distractors": [
        "cô",
        "mấy",
        "chút"
      ]
    },
    {
      "type": "listen_pick_text",
      "concept": "c_pho",
      "distractors": [
        "ơi",
        "đâu",
        "cậu"
      ]
    },
    {
      "type": "listen_pick_text",
      "concept": "c_com_tam",
      "distractors": [
        "cảm ơn",
        "nước mía"
      ]
    },
    {
      "type": "listen_pick_text",
      "concept": "c_banh_mi",
      "distractors": [
        "sầu riêng",
        "em út"
      ]
    },
    {
      "type": "listen_pick_image",
      "concept": "c_com_tam",
      "distractors": [
        "c_song_river",
        "c_da_ice",
        "c_ngu_sleep"
      ]
    },
    {
      "type": "listen_pick_image",
      "concept": "c_banh_mi",
      "distractors": [
        "c_sua_milk",
        "c_cay_xang",
        "c_den_do"
      ]
    },
    {
      "type": "fill_gap",
      "text": "Món này hơi ___.",
      "answer": "dở",
      "options": [
        "dở",
        "dơ",
        "ạ",
        "tuổi"
      ],
      "translation": {
        "fr": "Ce plat n'est pas terrible.",
        "en": "This dish isn't great."
      }
    },
    {
      "type": "fill_gap",
      "text": "Cho em một tô ___.",
      "answer": "phở",
      "options": [
        "phở",
        "ơi",
        "đi",
        "tư"
      ],
      "translation": {
        "fr": "Un bol de phở, s'il te plaît.",
        "en": "A bowl of phở, please."
      }
    },
    {
      "type": "fill_gap",
      "text": "Anh ăn ___ chưa?",
      "answer": "cơm tấm",
      "options": [
        "cơm tấm",
        "cảm ơn",
        "hôm nay",
        "sau Tết"
      ],
      "translation": {
        "fr": "Tu as déjà goûté le cơm tấm ? (à un homme un peu plus âgé)",
        "en": "Have you tried cơm tấm? (to a slightly older man)"
      }
    },
    {
      "type": "build_sentence",
      "target": "Cho em một tô phở",
      "tokens": [
        "Cho",
        "em",
        "một",
        "tô",
        "phở"
      ],
      "translation": {
        "fr": "Un bol de phở, s'il te plaît.",
        "en": "A bowl of phở, please."
      },
      "audioConcept": "c_pho"
    },
    {
      "type": "build_sentence",
      "target": "Anh ăn cơm tấm chưa",
      "tokens": [
        "Anh",
        "ăn",
        "cơm",
        "tấm",
        "chưa"
      ],
      "translation": {
        "fr": "Tu as déjà goûté le cơm tấm ? (à un homme un peu plus âgé)",
        "en": "Have you tried cơm tấm? (to a slightly older man)"
      },
      "audioConcept": "c_com_tam"
    }
  ],
  "review": {
    "srsIntroduce": [
      "c_do_bad",
      "c_do_dirty",
      "s_do_qua",
      "s_cung_duoc",
      "c_hoi_slightly"
    ]
  },
  "reviewed": false
}
