{
  "$schema": "../../../schema/lesson.schema.json",
  "id": "vi-south.u15.l07",
  "unit": "vi-south.u15",
  "kind": "review",
  "title": {
    "fr": "Révision : téléphone et messages",
    "en": "Review: phone and messages"
  },
  "goal": {
    "fr": "Revoir les formules du téléphone et des messages.",
    "en": "Go over phone and messaging phrases."
  },
  "estimatedMinutes": 6,
  "prerequisites": [
    "vi-south.u15.l06"
  ],
  "concepts": [
    "s_alo_em_nghe",
    "c_goi",
    "c_goi_pack",
    "c_goi_salad",
    "c_tin_nhan",
    "c_dien_thoai",
    "c_sach",
    "s_het_pin",
    "c_goi_lai",
    "c_nhan_tin",
    "c_doi_wait",
    "c_ban_busy",
    "c_sac_pin"
  ],
  "steps": [
    {
      "type": "listen_pick_text",
      "concept": "s_alo_em_nghe",
      "distractors": [
        "Alô, em nói.",
        "Có xa không?"
      ],
      "explain": {
        "fr": "em nghe : j'écoute. nghỉ : se reposer.",
        "en": "em nghe: I'm listening. nghỉ: to rest."
      }
    },
    {
      "type": "tone_minimal_pair",
      "pair": [
        "gọi",
        "gói",
        "gỏi"
      ],
      "audioConcepts": [
        "c_goi",
        "c_goi_pack",
        "c_goi_salad"
      ],
      "explain": {
        "fr": "gọi tombe court : appeler. gói monte : paquet. gỏi plonge : salade.",
        "en": "gọi drops short: to call. gói rises: package. gỏi dips: salad."
      }
    },
    {
      "type": "build_sentence",
      "target": "Em đang bận, lát em gọi lại nha.",
      "tokens": [
        "Em",
        "đang",
        "bận",
        "lát",
        "em",
        "gọi lại",
        "nha",
        "bán"
      ],
      "translation": {
        "fr": "Je suis occupé(e), je te rappelle tout à l'heure.",
        "en": "I'm busy, I'll call you back in a bit."
      },
      "explain": {
        "fr": "đang bận + lát gọi lại : la formule parfaite.",
        "en": "đang bận + lát gọi lại: the perfect line."
      }
    },
    {
      "type": "listen_pick_image",
      "concept": "c_tin_nhan",
      "distractors": [
        "c_dien_thoai",
        "c_sach"
      ],
      "explain": {
        "fr": "tin nhắn : le message.",
        "en": "tin nhắn: text message."
      }
    },
    {
      "type": "build_sentence",
      "target": "Nhắn Zalo cho em nha.",
      "tokens": [
        "Nhắn",
        "Zalo",
        "cho",
        "em",
        "nha",
        "gọi"
      ],
      "translation": {
        "fr": "Envoie-moi un message sur Zalo.",
        "en": "Message me on Zalo."
      },
      "explain": {
        "fr": "nhắn + appli + cho + personne.",
        "en": "nhắn + app + cho + person."
      }
    },
    {
      "type": "spot_the_south",
      "variant": "lv_nha",
      "explain": {
        "fr": "Sud : nha ; Nord : nhé.",
        "en": "South: nha; North: nhé."
      }
    },
    {
      "type": "match_pairs",
      "concepts": [
        "c_goi_lai",
        "c_nhan_tin",
        "c_doi_wait",
        "c_ban_busy",
        "c_sac_pin"
      ]
    },
    {
      "type": "listen_pick_text",
      "concept": "s_het_pin",
      "distractors": [
        "Điện thoại em hết tiền rồi.",
        "Điện thoại em còn pin."
      ],
      "explain": {
        "fr": "hết pin : plus de batterie. còn : encore.",
        "en": "hết pin: battery dead. còn: still some left."
      }
    },
    {
      "type": "listen_gist",
      "dialogue": "dlg_goi_dien_thoai",
      "explain": {
        "fr": "La raison est donnée dès la troisième réplique.",
        "en": "The reason is given as early as the third line."
      }
    },
    {
      "type": "build_sentence",
      "target": "Chị nhắn lại giùm em nha.",
      "tokens": [
        "Chị",
        "nhắn",
        "lại",
        "giùm",
        "em",
        "nha",
        "gọi"
      ],
      "translation": {
        "fr": "Tu peux lui laisser un message de ma part ? (à une femme un peu plus âgée)",
        "en": "Could you pass on a message for me? (to a slightly older woman)"
      },
      "explain": {
        "fr": "verbe + giùm + personne : faire pour quelqu'un.",
        "en": "verb + giùm + person: do for someone."
      }
    },
    {
      "type": "listen_pick_text",
      "concept": "c_goi_pack",
      "distractors": [
        "gọi",
        "gỏi",
        "vé"
      ]
    },
    {
      "type": "listen_pick_text",
      "concept": "c_goi_salad",
      "distractors": [
        "gọi",
        "gói",
        "bả"
      ]
    },
    {
      "type": "listen_pick_text",
      "concept": "c_dien_thoai",
      "distractors": [
        "công ty",
        "mắc cười"
      ]
    },
    {
      "type": "listen_pick_text",
      "concept": "c_sach",
      "distractors": [
        "rẻ",
        "lớn",
        "ngủ"
      ]
    },
    {
      "type": "listen_pick_text",
      "concept": "c_goi",
      "distractors": [
        "gỏi",
        "gói",
        "có"
      ]
    },
    {
      "type": "listen_pick_text",
      "concept": "c_tin_nhan",
      "distractors": [
        "sạc pin",
        "hôm nay"
      ]
    },
    {
      "type": "listen_pick_text",
      "concept": "c_goi_lai",
      "distractors": [
        "điện thoại",
        "nhân viên"
      ]
    },
    {
      "type": "listen_pick_text",
      "concept": "c_nhan_tin",
      "distractors": [
        "xe ôm",
        "công viên"
      ]
    },
    {
      "type": "listen_pick_text",
      "concept": "c_doi_wait",
      "distractors": [
        "hông",
        "sao",
        "xin"
      ]
    },
    {
      "type": "listen_pick_text",
      "concept": "c_ban_busy",
      "distractors": [
        "ngủ",
        "hỏi",
        "vé"
      ]
    },
    {
      "type": "listen_pick_text",
      "concept": "c_sac_pin",
      "distractors": [
        "ông bà",
        "nhắn tin"
      ]
    },
    {
      "type": "listen_pick_image",
      "concept": "c_dien_thoai",
      "distractors": [
        "c_benh_vien",
        "c_ly",
        "c_chen"
      ]
    },
    {
      "type": "game",
      "game": "cho_noi",
      "conceptPool": "lesson"
    }
  ],
  "review": {
    "srsIntroduce": []
  },
  "reviewed": false
}
